id,question,answer
486,What nickname does Ron use when referring to Viktor Krum?,Vicky
487,"What term did Hagrid claim both himself and Madame Maxime were, leading to her anger?",half-giant
488,What password did Cedric give Harry for the prefects' bathroom?,pine fresh
489,"What dangerous creatures did Hagrid admit to breeding, according to the article in the newspaper?",Blast-Ended Skrewts
490,What is the name of Hagrid's mother as revealed by the Daily Prophet?,Fridwulfa
491,What specific location did Bertha Jorkins visit where she met her second cousin before vanishing?,Albania
492,What was the name of Rita Skeeter's photographer?,Bozo
493,What excuse did Dumbledore provide for not hearing Harry's initial statement?,I have gone temporarily deaf
494,What password did Cedric tell Harry to use to enter the bathroom?,Pine fresh
495,Who was unexpectedly moving in Snape's office according to the Marauders Map?,Bartemius Crouch
496,What did Filch identify the golden egg as when he discovered it at the bottom of the staircase?,Triwizard clue
497,"What person did Harry identify, using the Marauders Map, as the one who broke into Snape's office?",Mr. Crouch
498,What career did Moody suggest Harry consider?,An Auror
499,What rule would Harry break if he summoned an Aqua-Lung from a Muggle town?,International Code of Wizarding Secrecy
500,What spell described in 'Weird Wizarding Dilemmas and Their Solutions' did Hermione find irrelevant and comical?,make their nose hair grow into ringlets
501,What will gillyweed enable Harry to do underwater?,breathe underwater
502,What appeared on the grindylows' skin when struck by Harry's spell?," ""angry red patches on their green skin"""
503,Why did Harry bring Fleur's sister to the surface?,Fleur didn't turn up
504,What creatures attacked Fleur as she approached her goal during the second task?,grindylows
505,Why did Hermione say she didn't immediately respond to Viktor Krum's invitation?,seeing whether you and Harry were okay
506,What clear potion does Snape show to Harry during their confrontation in the dungeon?,Veritaserum
507,"What was the black dog carrying in its mouth when first seen by Harry, Ron, and Hermione?",some newspapers
508,What position did Barty Crouch previously hold according to Sirius?,Head of the Department of Magical Law Enforcement
509,"What did Crouch allow his son to have before sending him to Azkaban, according to Sirius?",a trial
510,Who does Winky still believe is her master despite Dobby's assurance that Dumbledore is now her master?,Mr. Crouch
511,What does the house-elf say house-elves have no right to be when there is work and masters?,unhappy
512,Why are nifflers considered useful treasure detectors according to Hagrid?,like sparkly stuff
513,What did Ron wish he had?,a niffler
514,Where is the Triwizard Cup placed during the third task according to Bagman?,in the center of the maze
515,What did Mr. Crouch say the Dark Lord was becoming during his disoriented speech?,stronger
516,Who did Krum claim attacked him from behind?,the old madman
517,Why does Hermione suggest they see Professor Moody?,We need to find out whether he found Mr. Crouch
518,Why did Hermione suggest Mr. Crouch might have left the school grounds according to the excerpt?,The map shows invisible people
519,Who was Voldemort going to feed to the snake instead of Wormtail?,Harry Potter
520,What password successfully opened the gargoyle guarding Dumbledore's office when Harry tried it?,Cockroach Cluster
521,"What did Harry find when he looked up at the ceiling in the mysterious room, contrary to his expectation of seeing a circular window?","dark, solid stone"
522,Which individual did Dumbledore confirm was a former Death Eater turned spy for the good side?,Severus Snape
523,What did Mr. Crouch explicitly say to his son during their confrontation to reject parental ties?,You are no son of mine!
524,What does Dumbledore say one can do to examine their thoughts more effectively using the Pensieve?,spot patterns and links
525,Where are Neville's parents being kept according to Dumbledore?,St. Mungo's Hospital for Magical Maladies and Injuries
526,What spell did Hermione use to counteract Harry's Shield Charm?,Jelly-Legs Jinx
527,Which family was Harry worried might attend the Triwizard Tournament gathering?,the Dursleys
528,Which path did Harry choose when he and Cedric reached a fork in the maze?,left one
529,What curse did Krum cast on Cedric?,Crucio!
530,What creature does Harry name as the answer to the sphinx's riddle?,spider
531,Why did Cedric initially refuse to take the Triwizard Cup before Harry?,You told me about the dragons
532,What name was inscribed on the marble headstone to which Harry was bound?,TOM RIDDLE
533,What color did the potion turn after Harry's blood was added to the cauldron?,blinding white
534,What did Voldemort replace Wormtail's missing hand with?,silver hand
535,What term did Voldemort use to describe Harry's presence at his rebirthing party?,guest of honor
536,"What did Voldemort specifically require as the third ingredient for the potion that revived him, besides his servant's flesh and father's bone?",Harry Potters blood
537,What did Cedric Diggory's shade explicitly instruct Harry to do as it emerged from Voldemort's wand?,Hold on. Harry
538,What did the old man ask Voldemort upon emerging from the wand?,"He was a real wizard, then?"
539,Who admitted to placing Harry's name in the Goblet of Fire?,Moody
540,Who told Cedric Diggory to open the egg underwater?,I did
541,How did Barty Crouch Sr. subdue his son according to the imposter's statement?,The Imperius Curse
542,What was the lasting effect on Bertha Jorkins after Crouch Senior used a powerful Memory Charm on her?,damaged her memory permanently
543,What map did Barty Crouch Jr. take from Harry Potter?,Potter's map of Hogwarts
544,Why didn't Harry's and Voldemort's wands work properly against each other?,they share cores
545,What did the dementor do to Barty Crouch's soul?,sucked his soul out through his mouth
546,Why does Fudge defend Lucius Malfoy?,A very old family - donations to excellent causes -
547,What did Snape call the mark on his arm when he showed it to Fudge?,The Dark Mark
548,Who did Harry believe should have won the Triwizard Tournament instead of himself?,Cedric
549,What was Hagrid's secret task over the summer?,a little job fer me over the summer
550,What secret ability does Hermione claim Rita Skeeter possesses?,an unregistered Animagus
551,What charm did Hermione use to prevent the beetle from transforming?,Unbreakable Charm
552,What did Harry explicitly tell the twins to buy for Ron using the money?,different dress robes
