id,question,answer
245,What did Harry claim Seamus' mother believed about him and Dumbledore?,She thinks I'm a liar and Dumbledore's an old fool
246,What was the title of the sign that Fred and George Weasley put up in the Gryffindor common room?,GALLONS OF GALLEONS!
247,Why does George state that Nosebleed Nougat is cheap?,"Because you'll keep bleeding till you shrivel up, we havenn't got an antidote yet"
248,How long did Cho Chang say she had supported the Tornados Quidditch team?,since I was six
249,What spell did Professor Snape use to eliminate Harry's potion?,Evanesce.
250,What is the third course aim listed by Professor Umbridge?,Placing the use of defensive magic in a context for practical use.
251,How does Professor Umbridge describe Cedric Diggory's death?,a tragic accident
252,What type of biscuit did Harry take from Professor McGonagall's tin?,Ginger Newt
253,What was the title of the essay that Ron was writing for Snape's homework?," ""the properties of moonstone and its uses in potion-making"""
254,What did Professor Grubbly-Plank say in response when Harry asked where Hagrid was?,Never you mind
255,What two creatures did Luna Lovegood mention as examples of things people believed did not exist?,the Blibbering Humdinger or the Crumple-Horned Snorkack
256,What did the quill use instead of ink when Harry wrote during his detention?,his own blood
257,What words were etched into the back of Harry's hand after his third detention with Umbridge?,I must not tell lies
258,What was Angelina's blunt assessment of Ron's Keeper tryout performance?,he's not fabulous
259,Why does Hermione tell Harry not to put certain information in letters?," ""owls aren't being intercepted any more"""
260,What name did Harry whisper to Hedwig indicating the true recipient of the letter despite the listed address?,Sirius
261,What was the headline of the article in the Daily Prophet detailing Sturgis Podmore's illegal entry into the Ministry?,TRESPASS AT MINISTRY
262,What did Fred say Katie swallowed by mistake?,Blood Blisterpod
263,What individual did Percy mention as having been sent to Azkaban for trespass at the Ministry?,Sturgis Podmore
264,What did Hermione correct in Harry's essay regarding Europa?,"covered in ice, not mice"
265,What is the name of the position Dolores Umbridge was appointed to according to the Daily Prophet article's headline?,High Inquisitor
266,What does the grade 'P' stand for in the Hogwarts grading system according to the Gryffindor students?,Poor
267,What did Professor Trelawney claim she sensed regarding Professor Umbridge's future?,in grave danger
268,What phrase was Harry required to write repeatedly during his detention with Professor Umbridge?,I must not tell lies
269,Why did Professor McGonagall explain that vanishing a mouse is more challenging than vanishing a snail?,the complexity of the animal to be Vanished
270,What does Hermione suggest Harry should do for the group's defense training?,teaching us Defence Against the Dark Arts
271,What had Hermione progressed to Vanishing in Transfiguration before the Defence lesson idea was brought up again?,kittens
272,Why did Hermione choose the Hog's Head over the Three Broomsticks for the meeting?,students don't normally go in there
273,What is the name of the Hufflepuff Quidditch team member who questions Harry about the proof of Voldemort's return?,Zacharias Smith
274,What does Luna Lovegood claim Cornelius Fudge has an army of?,Heliopaths
275,What is the title of the chapter in which the notice about disbanding student groups is posted?,Educational Decree Number Twenty-four
276,What did Hermione do to the parchment they all signed?,put a jinx on that piece of parchment
277,What conclusion did Professor Grubbly-Plank reach about the cause of Hedwig's injury?,something's attacked her
278,What specific ward did Draco Malfoy claim St Mungo's has for people affected by magical damage?,special ward for people whose brains have been addled by magic
279,What does Hermione believe about Professor Trelawney's abilities?,an absolutely appalling teacher and a real old fraud
280,What did Hermione suggest was needed instead of an Invisibility Cloak for hiding twenty-eight students in the Shrieking Shack?,an Invisibility Marquee
281,What accusation did Filch make against Harry that led Hermione to suspect Umbridge was involved?,ordering Dungbombs
282,How does Harry describe the way he senses Voldemort's state?,flashes of what mood he's in
283,How many people does Harry need to accommodate to practice Defence Against the Dark Arts without being discovered by the teachers?,twenty-eight
284,What is another name for the Room of Requirement according to Dobby?,the Come and Go Room
285,What does the DA in the group's name stand for according to Ginny's suggestion?,Dumbledore's Army
286,What magical charm did Hermione use on the fake Galleons to make them change when Harry adjusted the meeting time?,Protean Charm
287,Who hexed Alicia Spinnet with a charm that caused her eyebrows to grow uncontrollably?,Miles Bletchley
288,"According to the song sung by the Slytherin fans, where was Ron Weasley born?",a bin
289,What hit Harry immediately after he caught the Golden Snitch?,a Bludger
290,What object was Harry holding when he punched Draco Malfoy?,the Snitch
291,What did Hermione announce that might cheer Harry and Ron up?,Hagrid's back
292,Who accompanied Hagrid on his mission to find the giants?,Madame Maxime
293,What specific item did Hagrid present to Karkus as a gift from Dumbledore?,a branch o' Gubraithian fire
294,Whose head was found at the bottom of the lake according to Hagrid?,Karkus's
295,What Death Eater did Hagrid recognize visiting the Gurg?,Macnair
296,"What title, besides Defence Against the Dark Arts teacher, does Umbridge announce upon arriving at Hagrid's cabin?",Hogwarts High Inquisitor
297,What was Hagrid carrying over his shoulder when the class arrived on Tuesday?,half a dead cow
298,What did Hagrid mistakenly attribute the sound of Umbridge's fake cough to?,Thestral
299,What term does Hermione directly use to describe Professor Umbridge after the latter announces her intention to walk among the students and ask questions?,evil hag
300,What did Luna Lovegood mention that the mistletoe is often infested with?,Nargles
301,"According to Harry, what is the mistletoe over his head full of?",Nargles
302,What did Harry claim attacked Ron's father in his dream?,a huge snake
303,What perspective did Harry state he had when witnessing the attack on Mr. Weasley?," ""the snake's point of view"""
304,"What does the smoke serpent do when Dumbledore asks, 'But in essence divided?'",split itself into two snakes
305,What object did Dumbledore indicate as the Portkey in his office?,the old kettle
306,What was the exact phrase used by the parchment's message to describe Mr. Weasley's condition before Mrs. Weasley arrived?,Dad is still alive
307,Why couldn't St. Mungo's be placed underground like the Ministry?,wouldn't be healthy
308,What ward was Arthur Weasley moved to according to the Welcome Witch?,Dai Llewellyn Ward
309, that Voldemort is attempting to utilize?,the weapon
310,What exact message did Phineas Nigellus say Dumbledore had for Harry?,Stay where you are
311,What specific phrase did Hermione's Christmas gift to Harry utter when a page was opened?,Do it today or later you'll pay!
312,"According to Sirius, where does Kreacher sleep?",under the boiler in that cupboard off the kitchen
313,Why had Mr. Weasley’s bandages been changed a day early?,Augustus Pye
314,What does Mrs. Longbottom claim caused the condition of Neville's parents?,tortured into insanity by You-Know-Who's followers
315,What curse was Bellatrix Lestrange accused of using on Neville's parents that led to her imprisonment in Azkaban?,Cruciatus Curse
316,What was Snape’s exact response when Sirius asked if he was calling him a coward?,"Why, yes, I suppose I am."
317,What type of classes is Harry anticipating Snape will teach in a manner he describes as 'foully'?," ""Occlumency classes"""
318,Why does Professor Dumbledore want Harry to learn Occlumency?,to close your mind to the Dark Lord
319,Why did the Dark Lord become aware that Harry was accessing his thoughts?," ""such a powerful incursion upon the Dark Lord's thoughts"""
320,What location does the corridor that Harry recognized lead to?,the Department of Mysteries
321,What did the Ministry fear Sirius Black had become for the Death Eaters according to the Daily Prophet headline?,RALLYING POINT
322,What type of plant caused Broderich Bode's death according to the newspaper report?,Devil's Snare
323,What was the number of the Educational Decree issued by Dolores Umbridge that prohibited teachers from giving students information unrelated to their subjects?,Twenty-six
324,What was featured on the poster in the window of Dervish and Banges?,the pictures of the ten escaped Death Eaters
325,What decorations were hovering over the tables at Madam Puddifoot's and threw pink confetti?,golden cherubs
326,What did Hagrid claim caused the injuries on his face?,normal bumps an' bruises
327,What does Hermione threaten to report Rita Skeeter as if she refuses to conduct Harry's interview?,unregistered Animagus
328,What did Hermione specifically criticize Harry for being during his date with Cho?,a bit tactless
329,What was the final score of the Quidditch match between Gryffindor and Hufflepuff?,two hundred and forty versus two hundred and thirty
330,What educational decree number is cited as the basis for banning The Quibbler at Hogwarts?,Twenty-seven
331,What was Bode attempting to steal that resulted in him being hospitalized in St. Mungo's?,the weapon
332,Why was Sturgis Podmore arrested?,arrested for trying to get through a door
333,Why do you call Voldemort the Dark Lord? I've only ever heard Death Eaters call him that.,Death Eaters
334,Why can't Firenze return to the Forbidden Forest?,My herd has banished me
335,Why did the other centaurs banish Firenze?,Because I have agreed to work for Professor Dumbledore
336,What was Dobby's exact response when Harry asked if Umbridge was coming?,"Yes, Harry Potter, yes!"
337,What is the full name of the student who was brought into the office as an informant?,Marietta Edgecombe
338,When did the Ministry Decree banning student societies come into effect relative to Harry's meeting in the Hog's Head?,not put into effect until two days after Harry's Hogsmeade meeting
339,What name did Dumbledore give to the student organization he admitted to organizing to Fudge?,Dumbledore's Army
340,What additional penalty did Malfoy claim to deduct from Hermione for being a Mudblood?,ten off
341,What decree did Filch mention that would allow him to punish students harshly?,Educational Decree Number Twenty-nine
342,What specific type of fireworks did Fred and George use in their prank?,Weasleys' Wildfire Whiz-bangs
343,What did Harry suspect Snape was trying to hide by keeping his thoughts in the Pensieve?,information about the Department of Mysteries
344,What was the exact heading of the examination paper that Snape was working on in his memory?,DEFENCE AGAINST THE DARK ARTS - ORDINARY WIZARDING LEVEL
345,What is the relationship between the girl with thick dark red hair and startlingly green eyes and Harry?,Harry's mother
346,Who did Harry blame for his argument with Cho?,Marietta
347,What specific items were used to decorate Harry's Easter egg from Mrs. Weasley?,"small, iced Snitches"
348,What item does Harry plan to use to gain access to Umbridge's office?,Sirius's knife
349,What minimum number of NEWTs and grade requirement does Professor McGonagall state are needed to become an Auror?,"five NEWTs, and nothing under 'Exceeds Expectations' grade"
350,Whom did Harry encounter in the kitchen fireplace at Grimmauld Place when he arrived via Floo powder?,Lupin
351,What was Filch searching for in Professor Umbridge's desk?,Approval for Whipping
352,What were the objects trailing one of Fred and George's broomsticks as they fled?,heavy chain and iron peg
353,Where did Harry claim Fred and George obtained the funds for their Diagon Alley premises?,Triwizard winnings
354,Why does Hagrid say he brought the crossbow on his trip into the forest?,a precaution
355,Why did Hagrid intervene to stop the centaurs according to his own words?,couldn't stand by an' watch 'em kill 'im
356,What was Grawp's height as mentioned by Hagrid when explaining why he was considered small for a giant?,sixteen foot
357,What name did Hagrid suggest Grawp use for Hermione?,Hermy
358,What specific accusation does the grey centaur make against Firenze?,entered into servitude to humans
359,What name does Grawp recognize Hermione by?,Hermy
360,Who does Draco Malfoy claim is the head of the Wizarding Examinations Authority?,Griselda Marchbanks
361,What form did Harry's Patronus take during the Defense Against the Dark Arts exam?,silver stag
362,What creature was placed in Umbridge's office according to Hermione's account?,Nifiler
363,Who sent a Stunning Spell at Hagrid as he ran toward the gates?,Umbridge
364,Why did the warlocks of Liechtenstein refuse to join the International Confederation of Wizards according to Harry's recollection?,because Bonaccord had wanted to stop troll-hunting and give trolls rights
365,In which specific location within the Department of Mysteries does Harry claim Sirius is being held by Voldemort?,at the end of row ninety-seven
366,What specific method did Hermione suggest to contact Sirius to verify his location before proceeding to the Department of Mysteries?,Umbridge's fire
367,What location did Harry specifically ask Kreacher if Sirius had gone to?,Department of Mysteries
368,Where was Harry's Firebolt according to Professor Umbridge?,under strict guard in the dungeons
369,What curse did Umbridge threaten to use on Harry to make him talk?,Cruciatus Curse
370,Where did Hermione indicate the weapon was hidden?,dark trees
371,Which centaur was referred to as a traitor by the other centaurs?,Firenze
372,What does Luna claim that Hagrid says about the creatures they see between the trees?,very good at finding places their riders are looking for
373,What does Hagrid use to attract Thestrals?,raw meat
374,What was the label on the topmost badge Harry examined in the telephone box?,"Harry Potter, Rescue Mission"
375,What did the brains in the green liquid look like when Harry examined them up close?,slimy cauliflowers
376,What was written on the label beneath the date on the glass orb that Harry examined?,S.P.T. to A.P.W.B.D. Dark Lord and (?)Harry Potter
377,"What spell did Harry cast to protect the prophecy when Bellatrix tried to steal it with ""Accio""?",Protego
378,Why couldn't Voldemort retrieve the prophecy himself according to Malfoy?,only those about whom it was made
379,What did Hermione exclaim upon witnessing the Death Eater's transformation in the bell jar?,It's Time
380,Which room are Harry and the others in when Luna is knocked unconscious?,Brain Room
381,What did Harry shout as a warning immediately before Ron touched the brain?,"RON, NO!"
382,"Which Death Eater did Harry defeat by shouting 'STUPEFY!' while being choked, whose mask revealed his identity as Buckbeak's would-be killer?",Macnair
383,In what manner did Sirius's body move as he fell through the veil?,curved in a graceful arc
384,What spell did Bellatrix cast to deflect Harry's Stunning Spell?,Protego
385,What did Fawkes swallow that was fired at Dumbledore?,the jet of green light
386,What object did Dumbledore use as a Portkey?,the golden head of the statue
387,What does Harry declare he no longer wants to be after throwing the silver instrument?,human
388,What did Dumbledore claim to observe stirring behind Harry's eyes during their close contact?,a shadow of him stir
389,"What did Dumbledore specifically mention as the reason he chose to leave Harry with the Dursleys, despite the difficult circumstances?",your mother died to save you
390,Why did Dumbledore describe the bond of blood as the strongest shield for Harry?,Your mother's sacrifice
391,Why did Voldemort choose Harry over Neville as the target of the prophecy?,He saw himself in you before he had ever seen you
392,What evasive title does Minister Fudge use when referring to the leader of the Dementors in his statement?,Lord - Thingy
393,What does Malfoy inform Harry about the Dementors at Azkaban?,The Dementors have left Azkaban
394,Who did Hagrid mention wanting to find a lady friend for?,Grawp
395,"According to Nearly Headless Nick, what will Sirius have done instead of returning as a ghost?",gone on
396,"What did Malfoy, Crabbe, and Goyle resemble after the DA members' attack on the Hogwarts Express?",three gigantic slugs
397,What material did Fred claim his new jacket was made of?,dragonskin
398,What did the villagers continue to call the house even after the Riddle family had moved out?,the Riddle House
399,"What event's completion must occur before the plan can proceed, as stated by the cold voice?",the Quidditch World Cup is over
400,What does the second voice claim will happen after one more death?,our path to Harry Potter is clear
401,What did Frank Bryce drop when he saw what was sitting in the chair?,walking stick
402,What type of birds delivered Sirius's letters to Harry?,"large, brightly colored tropical birds"
403,Who sent the letter that Uncle Vernon received about Harry?,Mrs. Weasley
404,What did Harry say 'the normal way' refers to?,owl post
405,What was the name of the tiny owl that delivered Ron's letter to Harry?,Pig
406,What did Uncle Vernon believe about the Weasleys' punctuality?," ""don't set much store by punctuality"""
407,What two items does Mr. Weasley collect?,plugs and batteries
408,What was the name of the invention Fred and George tested on the Muggle boy?,Ton-Tongue Toffee
409,What is the purpose of the report Percy is working on?,standardize cauldron thickness
410,What did Ron sarcastically suggest the top-secret event Percy mentioned could be?,exhibition of thick-bottomed cauldrons
411,"What happens to wizards who Apparate improperly, according to Mr. Weasley?",left half of themselves behind
412,What object did Amos Diggory hold that served as the Portkey?,a moldy-looking old boot
413,What unusual clothing combination did the wizard colleague wear?," ""kilt and a poncho"""
414,"How many people would the group become once Bill, Charlie, and Percy arrived?",a party of ten
415,What specific article of clothing was the old wizard wearing during his argument with the Ministry wizard?,a long flowery nightgown
416,What did the fake wand turn into when activated?,a rubber chicken
417,What was Winky wearing in the Top Box?,a tea towel draped like a toga
418,Why does Winky believe Dobby is unable to find another position?,wanting paying for his work
419,What did the shamrock in the Irish mascot's performance create that fell onto the crowd?,heavy gold coins
420,What words did the leprechauns form after Bulgaria's Keeper Zograf was penalized for a foul?,"HA, HA, HA!"
421,What did the Bulgarian Minister of Magic say in a gloomy voice after Bulgaria's loss?,"Vell, ve fought bravely"
422,What happened to Mrs. Roberts' nightdress when she was upside down?,fell down
423,"What offensive term did Draco Malfoy use to describe Hermione Granger, leading Ron to yell, 'You watch your mouth!'?",Mudblood
424,"What spell was cast to summon the green, glittering skull in the sky?",MORSMORDRE
425,Who recognized the wand that Mr. Diggory was holding as belonging to them?,Harry
426,What punishment did Mr. Crouch declare for Winky's disobedience?,clothes
427,What name did You-Know-Who's supporters use to identify themselves?,Death Eaters
428,What did the Ministry official allegedly claim after the appearance of the Dark Mark?,nobody had been hurt
429,What was Mundungus Fletcher actually using for shelter instead of the tent he claimed?,a cloak propped on sticks
430,What did Fred claim he and George were doing when questioned by Mrs. Weasley?,Homework
431,What did the dustbins do according to Mr. Diggory's description of the incident at Mad-Eye's house?,fired rubbish everywhere
432,"According to Hermione, where is Durmstrang's location thought to be?",the far north
433,What did Malfoy claim was the fashion era of Ron's dress robes?,eighteen ninety
434,Who questioned the absence of the new Defense Against the Dark Arts teacher during the feast?,Hermione
435,Who decided to allow the Sorting Hat to choose students' houses?,Gryffindor
436,What color was the unusual eye of the stranger introduced as Professor Moody?,electric blue
437,What caused the Triwizard Tournament to be discontinued after its initial establishment?,the death toll mounted so high
438,What substance did Professor Sprout say was collected from the Bubotubers and used as an excellent remedy for stubborn acne?,bubotuber pus
439,What was the name of the dragon Hagrid owned for a brief period during their first year?,Norbert
440,What planet did Professor Trelawney identify as the unaspected one in Lavender Brown's chart?,Uranus
441,What did Moody claim he was doing when Professor McGonagall confronted him about transforming Draco Malfoy into a ferret?,Teaching
442,Why did Moody agree to teach at Hogwarts for only one year?,Special favor to Dumbledore
443,"According to Moody, who is the only known person to have survived the Avada Kedavra curse demonstrated in class?",Harry
444,What does Hermione's acronym S.P.E.W. stand for as she explains it to Harry and Ron?,Society for the Promotion of Elfish Welfare
445,Why does Hermione want to get an elf into the Department for the Regulation and Control of Magical Creatures?,they're shockingly underrepresented
446,What did Mad-Eye Moody command Harry to do while under the Imperius Curse?,Jump onto the desk
447,What color and symbol were used for the Gryffindor banner in the Great Hall decorations?,red with a gold lion
448,What were pulling the carriage that approached Hogwarts to bring Madame Maxime?,winged horses
449,What specific drink did Madame Maxime stipulate that her horses required?,single-malt whiskey
450,"Which two officials filled the additional seats at the staff table next to Dumbledore's, prompting Filch to add four chairs?",Ludo Bagman and Mr. Crouch
451,What is the minimum age requirement to enter the Triwizard Tournament according to Dumbledore's Age Line?,seventeen
452,What physical characteristic did Fred and George develop immediately following their failed attempt to cross the Age Line?,sprouted identical long white beards
453,What did Hermione find in her beef casserole?,a large talon
454,What name did Dumbledore read from the Goblet of Fire for the Hogwarts champion before Harry Potter?,Cedric Diggory
455,What did Fleur Delacour call Bagman's announcement of Harry as a Triwizard champion?,a joke
456,When is the first task of the Triwizard Tournament scheduled to take place?,November the twenty-fourth
457,What did Harry say in response to the Fat Lady's question about who was chosen as the school champion?,Balderdash
458,What was Hermione carrying in a napkin when she approached Harry at the portrait hole?,a stack of toast
459,Which two Hufflepuff students laughed unpleasantly when a Bouncing Bulb hit Harry in the face?,Ernie Macmillan and Justin FinchFletchley
460,What message appeared on Malfoy's badge when pressed?,POTTER STINKS!
461,What type of quill did Rita Skeeter use to conduct her interview with Harry while asking about his participation in the Triwizard Tournament?,Quick-Quotes Quill
462,What term did Rita Skeeter use in her article to describe Dumbledore?,obsolete dingbat
463,Which individual did Rita Skeeter quote as stating that Harry is rarely seen without Hermione Granger?,Colin Creevey
464,What was the incorrect name Hermione first used for Viktor Krum's Quidditch move?,WonkyFaint
465,Who was the landlady of the pub where Hagrid and Moody were earlier?,Madam Rosmerta
466,Which type of dragon has bronze-colored spikes along its tail?,Hungarian Horntail
467,Why was Karkaroff released from Azkaban according to Sirius?,He did a deal with the Ministry of Magic
468,What did Hermione suggest replacing the dragon's fangs with using a Switching Spell?,wine-gums
469,What does Harry say when Moody asks him what he is best at?,I haven't got any
470,What spell did Harry need to master in order to summon his Firebolt?,Summoning Charm
471,What number was tied around the neck of the Hungarian Horntail model that Harry pulled out?,four
472,What spell did Harry shout to summon his Firebolt during the task?,Accio Firebolt!
473,What score did Ludo Bagman assign to Harry's performance in the dragon task?,ten
474,What noise filled the room the moment Harry opened the golden egg?,loud and screechy wailing
475,"Who had previously prohibited Rita Skeeter from entering the school, according to Hagrid's statement?",Dumbledore
476,What specific clothing was Winky wearing when she was introduced in the Hogwarts kitchen?,a neat little skirt and blouse with a matching blue hat
477,What does Winky claim about her payment from Professor Dumbledore?,not yet getting paid
478,What does Winky call Mr. Bagman?,a bad wizard
479,What famous musical group was booked for the Yule Ball by Dumbledore?,Weird Sisters
480,What subject was Professor Snape going to test the students on during the last lesson of the term?,poison antidotes
481,Who did Cho Chang tell Harry she was going to the ball with?,Cedric Diggory
482,Why did Hermione's parents not allow her to use magic on her teeth?,they're dentists
483,What was the original owner of the mustard yellow socks that Harry gave to Dobby?,Uncle Vernon
484,How was Hermione's hair styled when Harry first saw her at the event?,twisted up into an elegant knot at the back of her head
485,What was the name of Mr. Crouch's house-elf whose misbehavior caused him personal shock?,Blinky
