question,answer
What specific condition did Will observe the Wall to be in?,Weeping
What type of tree did Will take cover under at the ridge?,ironwood
What adorned Ser Waymar Royce's sword hilt according to the text?,Jewels
How did Gared characterize his injury outcome compared to others?,light
What described the ground condition beneath the snow crust?,muddy
What exact type of axe remained at the abandoned campsite?,battle-axe
What moon phase provided light after twilight faded?,half-moon
What weather condition had occurred the night before their journey?,light snow